{
  "meta": {
    "source": "Dickinson_Sample_Slides.pptx",
    "total_slides": 9
  },
  "per_slide": [
    {
      "slide_index": 0,
      "section": null,
      "section_confidence": 0.0,
      "keyword_result": null
    },
    {
      "slide_index": 1,
      "section": null,
      "section_confidence": 0.0,
      "keyword_result": null
    },
    {
      "slide_index": 2,
      "section": null,
      "section_confidence": 0.0,
      "keyword_result": null
    },
    {
      "slide_index": 3,
      "section": null,
      "section_confidence": 0.0,
      "keyword_result": null
    },
    {
      "slide_index": 4,
      "section": null,
      "section_confidence": 0.0,
      "keyword_result": null
    },
    {
      "slide_index": 5,
      "section": null,
      "section_confidence": 0.0,
      "keyword_result": null
    },
    {
      "slide_index": 6,
      "section": null,
      "section_confidence": 0.0,
      "keyword_result": null
    },
    {
      "slide_index": 7,
      "section": null,
      "section_confidence": 0.0,
      "keyword_result": null
    },
    {
      "slide_index": 8,
      "section": null,
      "section_confidence": 0.0,
      "keyword_result": null
    }
  ],
  "overall": {
    "status": "FAIL",
    "score": 1.0,
    "update_required": true,
    "reasons": [
      "Missing required sections: Conclusion, Introduction, Methodology, Results",
      "Section Methodology has 0 slides; requires >= 1",
      "Section Results has 0 slides; requires >= 1",
      "Unassigned or low-confidence slides: 0, 1, 2, 3, 4, 5, 6, 7, 8"
    ],
    "recommendations": []
  },
  "section_summaries": []
}