{
  "meta": {
    "source": "deck_sample.json",
    "total_slides": 4
  },
  "per_slide": [
    {
      "slide_index": 0,
      "section": "Introduction",
      "section_confidence": 0.8,
      "keyword_result": {
        "section": "Introduction",
        "required_keywords": [
          "goal",
          "motivation"
        ],
        "found": [
          "goal",
          "motivation"
        ],
        "missing": [],
        "coverage": 1.0
      }
    },
    {
      "slide_index": 1,
      "section": "Methodology",
      "section_confidence": 1.0,
      "keyword_result": {
        "section": "Methodology",
        "required_keywords": [
          "data",
          "model",
          "training"
        ],
        "found": [
          "data",
          "model",
          "training"
        ],
        "missing": [],
        "coverage": 1.0
      }
    },
    {
      "slide_index": 2,
      "section": "Results",
      "section_confidence": 0.8,
      "keyword_result": {
        "section": "Results",
        "required_keywords": [
          "accuracy",
          "evaluation"
        ],
        "found": [
          "accuracy"
        ],
        "missing": [
          "evaluation"
        ],
        "coverage": 0.5
      }
    },
    {
      "slide_index": 3,
      "section": "Conclusion",
      "section_confidence": 1.0,
      "keyword_result": {
        "section": "Conclusion",
        "required_keywords": [
          "summary",
          "next steps"
        ],
        "found": [
          "next steps",
          "summary"
        ],
        "missing": [],
        "coverage": 1.0
      }
    }
  ],
  "overall": {
    "status": "NEEDS_UPDATE",
    "score": 0.875,
    "update_required": true,
    "reasons": [
      "Slides missing required keywords: 2",
      "Section Results average coverage 0.50 < 0.60"
    ],
    "recommendations": [
      "Slide 2 (Results): add missing keywords -> evaluation"
    ]
  },
  "section_summaries": [
    {
      "section": "Conclusion",
      "slides": 1,
      "avg_coverage": 1.0,
      "below_min_slides": []
    },
    {
      "section": "Introduction",
      "slides": 1,
      "avg_coverage": 1.0,
      "below_min_slides": []
    },
    {
      "section": "Methodology",
      "slides": 1,
      "avg_coverage": 1.0,
      "below_min_slides": []
    },
    {
      "section": "Results",
      "slides": 1,
      "avg_coverage": 0.5,
      "below_min_slides": []
    }
  ]
}